{"advisors":{"assessment":"REVIEWED_NO_NEW_MATERIAL_PHASE_B_REGRESSION","basis":["preflight and postflight Phase B structural/security projections are semantically identical","server-only authority/audit tables intentionally use RLS/FORCE RLS with no browser policies or browser table privileges","authenticated SECURITY DEFINER review RPC is intentional and runtime proof denied unauthorized reviewer while allowing authorized reviewer","runtime proof passed all trust-boundary checks and rolled back with zero residue","Phase A non-regression query returned PASS"],"material_security_findings":0,"notes":["advisor warnings and INFO entries remain recorded for later hardening; none changed the verified Phase B release contract"],"performance_advisor_reviewed":true,"security_advisor_reviewed":true},"classification":{"state":"STATE_A"},"execution":{"manual_ledger_write":false,"manual_sql_mutation":false,"mode":"APPLIED","pending_queue_runner_used":false},"ledger_after":{"entry_count":1,"phase_b_present":true},"ledger_before":{"entries":[{"name":"parts_vehicle_registry_id_compat","version":"20260626"},{"name":"vehicle_registry_compat","version":"20260627"},{"name":"lc04_profiles_bootstrap_from_git_20260706","version":"20260807192155"},{"name":"lc04_clerk_profile_bridge_from_git_20260707","version":"20260807192219"},{"name":"lc04_legacy_otp_hardening_from_git_20260628","version":"20260807192344"},{"name":"lc04_sovereign_phone_otp_proof_v1","version":"20260807192451"},{"name":"lc04_clerk_profiles_table_from_git_20260708","version":"20260807192639"},{"name":"lc04_clerk_jwt_rls_bridge_from_git_20260709","version":"20260807192655"},{"name":"lc04_atomic_profile_resolver_from_git_20260710","version":"20260807192716"},{"name":"lc04_tiger_sovereign_trust_fabric_20260807094000","version":"20260807192813"},{"name":"lc04_tiger_sovereign_runtime_atomicity_20260807104500","version":"20260807193020"},{"name":"lc04_tiger_sovereign_owner_stepup_20260807173000","version":"20260807193101"},{"name":"lc01_v13_1_authorization_foundation_from_v14","version":"20260807200814"},{"name":"lc01_v14_marketplace_foundation_source_rehearsal","version":"20260807201023"},{"name":"lc01_v14_marketplace_hardening_source_rehearsal","version":"20260807201039"},{"name":"lc03_supabase_security_hardening","version":"20260807221820"},{"name":"lc03_supabase_security_hardening","version":"20260807221821"},{"name":"lc03_supabase_security_hardening","version":"20260807221952"},{"name":"lc03_supabase_security_hardening","version":"20260807222033"},{"name":"staging_remove_legacy_tsrf_ai_otp_objects","version":"20260808163337"},{"name":"tsrf_ai_trust_fabric_20260808130000","version":"20260808163508"},{"name":"tsrf_ai_runtime_atomicity_20260808131000","version":"20260808163601"},{"name":"tsrf_owner_authorization_leases_20260808132000","version":"20260808163633"},{"name":"phone_otp_challenges_20260808133000","version":"20260808163703"},{"name":"lc04_production_legacy_rpc_hardening_staging_proof","version":"20260808170057"},{"name":"lc05_credential_surface_isolation_staging_proof","version":"20260808172415"},{"name":"lc06_rls_performance_hardening_staging_proof","version":"20260808174515"},{"name":"identity_01_fail_closed_profile_resolver_staging_proof","version":"20260808211445"},{"name":"global_launch_phase_a_identity_convergence_runtime_proof","version":"20260808212749"}],"phase_b_present":false},"phase_a_regression":{"duplicate_clerk_subject_groups":0,"private_helper_count":0,"profiles":{"authenticated_select_count":1,"browser_privilege_violation_count":0,"exists":true,"relforcerowsecurity":true,"relrowsecurity":true},"public_helper_count":0,"retired_credentials_server_only":true,"status":"PASS"},"runtime":{"checks":{"active_audit_present":true,"audit_mutation_denied":true,"authorized_reviewer_approved":true,"draft_owner_inserted":true,"inactive_country_denied":true,"non_clerk_denied":true,"self_promote_denied":true,"unauthorized_reviewer_denied":true},"status":"PASS"},"schema_after":{"canonical":true,"fingerprint":{"authority_rows_zero":true,"bucket_contract":{"allowed_mime_types":["image/jpeg","image/png","image/webp"],"file_size_limit":10485760,"public":false},"evaluator_result":{"canonical":true,"failures":[]},"marketplace_rows_zero":true,"projection_sha256":"9c484737fd7697f63eec2b73cb22a90ba77771c2388f101f11219971eb71d9eb","semantic_contract_equal_to_preflight":true,"semantic_contract_sha256":"ceeb9cdfc10bd1d85eacb4681e6dbae2fbde6f5c438b2dcb728e66da5f20e8bc","target_index_count":7,"target_policy_count":14,"target_table_count":12,"target_trigger_count":5}},"schema_before":{"canonical":true,"fingerprint":{"authority_seed_counts":{"assignment_revisions":0,"assignments":0,"authorization_audit_events":0,"country_seals":0,"envelope_audit":0,"permissions":0,"principals":0,"roles":0},"functions":[{"anon_execute":false,"authenticated_execute":false,"function_name":"vvip_current_actor_id","schema_name":"public"},{"anon_execute":false,"authenticated_execute":false,"function_name":"vvip_guard_authority_principal_mutation","schema_name":"public"},{"anon_execute":true,"authenticated_execute":true,"function_name":"vvip_marketplace_actor_id","schema_name":"public"},{"anon_execute":false,"authenticated_execute":false,"function_name":"vvip_marketplace_guard_listing_write","schema_name":"public"},{"anon_execute":false,"authenticated_execute":false,"function_name":"vvip_marketplace_record_listing_audit","schema_name":"public"},{"anon_execute":false,"authenticated_execute":false,"function_name":"vvip_marketplace_reject_audit_mutation","schema_name":"public"},{"anon_execute":false,"authenticated_execute":true,"function_name":"vvip_marketplace_review_listing","schema_name":"public"},{"anon_execute":false,"authenticated_execute":false,"function_name":"vvip_reject_authorization_audit_mutation","schema_name":"public"},{"anon_execute":false,"authenticated_execute":false,"function_name":"vvip_marketplace_actor_can_review","schema_name":"vvip_private"},{"anon_execute":true,"authenticated_execute":true,"function_name":"vvip_marketplace_country_is_active","schema_name":"vvip_private"}],"indexes":[{"indexname":"vvip_authority_assignments_principal_state_idx"},{"indexname":"vvip_authority_assignments_role_id_idx"},{"indexname":"vvip_marketplace_favorites_listing_id_idx"},{"indexname":"vvip_marketplace_listings_owner_idx"},{"indexname":"vvip_marketplace_listings_public_idx"},{"indexname":"vvip_marketplace_one_cover_per_listing"},{"indexname":"vvip_one_active_owner_root"}],"marketplace_row_counts":{"favorites":0,"listing_audit":0,"listings":0,"media":0},"policies":[{"policyname":"vvip_marketplace_favorites_owner"},{"policyname":"vvip_marketplace_media_owner_delete"},{"policyname":"vvip_marketplace_media_owner_insert"},{"policyname":"vvip_marketplace_media_owner_update"},{"policyname":"vvip_marketplace_media_read"},{"policyname":"vvip_marketplace_authenticated_read"},{"policyname":"vvip_marketplace_owner_delete"},{"policyname":"vvip_marketplace_owner_insert_draft"},{"policyname":"vvip_marketplace_owner_update"},{"policyname":"vvip_marketplace_public_read_active"},{"policyname":"vvip_listing_media_storage_owner_delete"},{"policyname":"vvip_listing_media_storage_owner_insert"},{"policyname":"vvip_listing_media_storage_owner_update"},{"policyname":"vvip_listing_media_storage_read"}],"storage_bucket":[{"allowed_mime_types":["image/jpeg","image/png","image/webp"],"file_size_limit":10485760,"id":"listing-media","name":"listing-media","public":false}],"table_privileges":[{"grantee":"authenticated","privilege_type":"DELETE","table_name":"vvip_marketplace_favorites"},{"grantee":"authenticated","privilege_type":"INSERT","table_name":"vvip_marketplace_favorites"},{"grantee":"authenticated","privilege_type":"SELECT","table_name":"vvip_marketplace_favorites"},{"grantee":"anon","privilege_type":"SELECT","table_name":"vvip_marketplace_listing_media"},{"grantee":"authenticated","privilege_type":"DELETE","table_name":"vvip_marketplace_listing_media"},{"grantee":"authenticated","privilege_type":"INSERT","table_name":"vvip_marketplace_listing_media"},{"grantee":"authenticated","privilege_type":"SELECT","table_name":"vvip_marketplace_listing_media"},{"grantee":"authenticated","privilege_type":"UPDATE","table_name":"vvip_marketplace_listing_media"},{"grantee":"anon","privilege_type":"SELECT","table_name":"vvip_marketplace_listings"},{"grantee":"authenticated","privilege_type":"DELETE","table_name":"vvip_marketplace_listings"},{"grantee":"authenticated","privilege_type":"INSERT","table_name":"vvip_marketplace_listings"},{"grantee":"authenticated","privilege_type":"SELECT","table_name":"vvip_marketplace_listings"},{"grantee":"authenticated","privilege_type":"UPDATE","table_name":"vvip_marketplace_listings"}],"tables":[{"exists":true,"force_rls":true,"rls":true,"table_name":"vvip_authority_assignment_revisions"},{"exists":true,"force_rls":true,"rls":true,"table_name":"vvip_authority_assignments"},{"exists":true,"force_rls":true,"rls":true,"table_name":"vvip_authority_permissions"},{"exists":true,"force_rls":true,"rls":true,"table_name":"vvip_authority_principals"},{"exists":true,"force_rls":true,"rls":true,"table_name":"vvip_authority_roles"},{"exists":true,"force_rls":true,"rls":true,"table_name":"vvip_authorization_audit_events"},{"exists":true,"force_rls":true,"rls":true,"table_name":"vvip_authorization_envelope_audit"},{"exists":true,"force_rls":true,"rls":true,"table_name":"vvip_country_authority_seals"},{"exists":true,"force_rls":true,"rls":true,"table_name":"vvip_marketplace_favorites"},{"exists":true,"force_rls":true,"rls":true,"table_name":"vvip_marketplace_listing_audit"},{"exists":true,"force_rls":true,"rls":true,"table_name":"vvip_marketplace_listing_media"},{"exists":true,"force_rls":true,"rls":true,"table_name":"vvip_marketplace_listings"}],"triggers":[{"trigger_name":"vvip_authority_principal_mutation_guard"},{"trigger_name":"vvip_authorization_audit_append_only_guard"},{"trigger_name":"vvip_marketplace_au